{"page":1,"pageSize":20,"totalItems":60,"totalPages":3,"items":[{"id":"i1","name":"Neon Echo","performerType":"Solo","genre":"Rock","description":"Neon Echo je fiktivní solo zaměřený na žánr rock a živá festivalová vystoupení."},{"id":"i2","name":"Neon Pulse","performerType":"Skupina","genre":"Pop","description":"Neon Pulse je fiktivní skupina zaměřený na žánr pop a živá festivalová vystoupení."},{"id":"i3","name":"Neon Drift","performerType":"Solo","genre":"Jazz","description":"Neon Drift je fiktivní solo zaměřený na žánr jazz a živá festivalová vystoupení."},{"id":"i4","name":"Neon Horizon","performerType":"Skupina","genre":"Elektronika","description":"Neon Horizon je fiktivní skupina zaměřený na žánr elektronika a živá festivalová vystoupení."},{"id":"i5","name":"Neon Mirage","performerType":"Solo","genre":"Hip-Hop","description":"Neon Mirage je fiktivní solo zaměřený na žánr hip-hop a živá festivalová vystoupení."},{"id":"i6","name":"Neon Bloom","performerType":"Skupina","genre":"Folk","description":"Neon Bloom je fiktivní skupina zaměřený na žánr folk a živá festivalová vystoupení."},{"id":"i7","name":"Neon Nova","performerType":"Solo","genre":"Rock","description":"Neon Nova je fiktivní solo zaměřený na žánr rock a živá festivalová vystoupení."},{"id":"i8","name":"Neon Wave","performerType":"Skupina","genre":"Pop","description":"Neon Wave je fiktivní skupina zaměřený na žánr pop a živá festivalová vystoupení."},{"id":"i9","name":"Neon Sphere","performerType":"Solo","genre":"Jazz","description":"Neon Sphere je fiktivní solo zaměřený na žánr jazz a živá festivalová vystoupení."},{"id":"i10","name":"Neon Tide","performerType":"Skupina","genre":"Elektronika","description":"Neon Tide je fiktivní skupina zaměřený na žánr elektronika a živá festivalová vystoupení."},{"id":"i11","name":"Neon Aura","performerType":"Solo","genre":"Hip-Hop","description":"Neon Aura je fiktivní solo zaměřený na žánr hip-hop a živá festivalová vystoupení."},{"id":"i12","name":"Neon Whisper","performerType":"Skupina","genre":"Folk","description":"Neon Whisper je fiktivní skupina zaměřený na žánr folk a živá festivalová vystoupení."},{"id":"i13","name":"Crimson Echo","performerType":"Solo","genre":"Rock","description":"Crimson Echo je fiktivní solo zaměřený na žánr rock a živá festivalová vystoupení."},{"id":"i14","name":"Crimson Pulse","performerType":"Skupina","genre":"Pop","description":"Crimson Pulse je fiktivní skupina zaměřený na žánr pop a živá festivalová vystoupení."},{"id":"i15","name":"Crimson Drift","performerType":"Solo","genre":"Jazz","description":"Crimson Drift je fiktivní solo zaměřený na žánr jazz a živá festivalová vystoupení."},{"id":"i16","name":"Crimson Horizon","performerType":"Skupina","genre":"Elektronika","description":"Crimson Horizon je fiktivní skupina zaměřený na žánr elektronika a živá festivalová vystoupení."},{"id":"i17","name":"Crimson Mirage","performerType":"Solo","genre":"Hip-Hop","description":"Crimson Mirage je fiktivní solo zaměřený na žánr hip-hop a živá festivalová vystoupení."},{"id":"i18","name":"Crimson Bloom","performerType":"Skupina","genre":"Folk","description":"Crimson Bloom je fiktivní skupina zaměřený na žánr folk a živá festivalová vystoupení."},{"id":"i19","name":"Crimson Nova","performerType":"Solo","genre":"Rock","description":"Crimson Nova je fiktivní solo zaměřený na žánr rock a živá festivalová vystoupení."},{"id":"i20","name":"Crimson Wave","performerType":"Skupina","genre":"Pop","description":"Crimson Wave je fiktivní skupina zaměřený na žánr pop a živá festivalová vystoupení."}]}